{
  "eventId": "33333333-3333-4333-8333-333333333333",
  "streamId": "44444444-4444-4444-8444-444444444444",
  "streamEpoch": 2,
  "sequence": 183,
  "occurredAt": null,
  "observedAt": "2026-10-21T12:00:01Z",
  "nodeId": "11111111-1111-4111-8111-111111111111",
  "instanceId": "22222222-2222-4222-8222-222222222222",
  "channel": "stderr",
  "level": "WARN",
  "message": "Upstream timeout; secret already redacted",
  "truncated": false
}
